Quelle,Stadt,Dateibezeichnung,Format,Beschreibung,Zeitlicher Bezug,Lizenz,Kosten,Veröffentlichende Stelle,Arbeitsmarkt,Bevölkerung,Bildung und Wissenschaft,Haushalt und Steuern,Stadtentwicklung und Bebauung,Wohnen und Immobilien,Sozialleistungen,Öffentl. Sicherheit,Gesundheit,Kunst und Kultur,Land- und Forstwirtschaft,Sport und Freizeit,Umwelt,Transport und Verkehr,"Energie, Ver- und Entsorgung",Politik und Wahlen,Gesetze und Justiz,Wirtschaft und Wirtschaftsförderung,Tourismus,Verbraucher,Sonstiges,Noch nicht kategorisiert,,URL
d,hamburg.de,Open Data Portal - Hamburg,DATA,"Die Freie und Hansestadt Hamburg bietet Ihnen auf diesem Portal (Beta-Version) zahlreiche Datensätze, Dienste und Anwendungen der Behörden und Ämter an. Die Datensätze werden von der Verwaltung im Sinne von ""Open Data"" frei verfügbar und nutzbar zur Verfügung gestellt. Sie können entsprechend der Nutzungsbedingungen und Lizenzen weiterverwendet werden, beispielweise für die Entwicklung von Apps. Mehr über die Rahmenbedingungen gibt es unter ""Information"" und in dem Artikel ""Rechtliches"". Die Inhalte des Portals werden fortlaufend ergänzt und weitere Datensätze aufgenommen.",,dl-de-by-1.0,,,,,,,,,,,,,,,,,,,,,,,,x,,
b ,hamburg.de,www.hamburg.de,XLSX,"Schülerinnen und Schüler mit sonderpädagogischem Förderbedarf an allgemeinen Schulen und Sonderschulen nach Schulform, Klassenart und ",,nicht bekannt,,Herbststatistik 2012,,,x,,,,,,,,,,,,,,,,,,,,12 45 5 1 2 5 6 0 0 62 14 76. 78 35 61 19 4 13 116 106 1 174 259 433 0.11850027367268746. 485 124 244 6 0 4 16 17 1 853 44 897 0.24548440065681446. 891 744 402 38 6 ...,http://www.hamburg.de/contentblob/3834460/data/schueler-sonder.xlsx
d,hamburg.de,Organigramm Rechnungshof (aktuell),PDF,Organigramm Rechnungshof,,dl-de-by-1.0,,Rechnungshof,,,,x,,,,,,,,,,,,,,,,,x,,,http://www.hamburg.de/rechnungshof/
g ,hamburg.de,Klassen_Schüler je Schule 2008,XLS,"Freie und Hansestadt Hamburg - Behörde für Schule und Berufsbildung - Referat für Unternehmensdatenmanagement und Statistik - Sachgebiet Statistik, V 122",,nicht bekannt,,,,,x,,,,,,,,,,,,,,,,,,,,,https://www.hamburg.de/contentblob/1159846/data/ex-klasse-schueler-2008-09.xls
b ,hamburg.de,www.hamburg.de,XLS,Eröffnungsbilanz der Freien und Hansestadt Hamburg zum 1. Januar 2006,,nicht bekannt,,,,,,x,,,,,,,,,,,,,,,,,,,Tabelle3 Bilanz Aktiva Passiva A. Anlagevermögen A. Eigenkapital I. Immaterielle Vermögensgegenstände II. Sachanlagen B. Sonderposten I. Sonderposten für ...,http://www.hamburg.de/contentblob/23830/data/zahlenwerk-kurzversion.xls
g ,hamburg.de,Kapazitätsauslastung 2012 Dekanat Tolasch ohne MKG,XLSX,Bettenstatistik 2012,,nicht bekannt,,,,,,,,,,,,,,,,,,,,,,,,,,http://justiz.hamburg.de/contentblob/4311654/data/bettenstatistik2012xlsx.xlsx
d,hamburg.de,Landesgrundbesitzverzeichnis,"GML,WMS","Das Landesgrundbesitzverzeichnis dient der Freien und Hansestadt Hamburg als Nachweis über alle landeseigenen Grundstücke und grundstücksgleichen Rechte. 

Landeseigener Grundbesitz ist in dem Verzeichnis auch dann aufgelistet, wenn er aufgrund dinglicher (Erbbaurechte u. ä.) oder obligatorischer (Miet- oder Pachtverträge u. ä.) Rechte Dritten überlassen ist.

Das Verzeichnis gliedert sich in das Allgemeine Grundvermögen, das Verwaltungs- (z.B. Straßenflächen) und Sondervermögen (z.B. Schulimmobilien).",,dl-de-by-1.0,,"Landesbetrieb Immobilienmanagement und Grundvermögen, Flächen- und Portfoliomanagement (Abteilung 45)
Management der Datenbanken und des grafischen Informationssystems (Referat 452)",,,,,x,x,,,,,,,,,,,,,,,,,,http://immobilien-lig.hamburg.de
b ,hamburg.de,www.hamburg.de,XLS,Verzeichnis von Schulen,,nicht bekannt,,,,,x,,,,,,,,,,,,,,,,,,,,Tabelle3 Tabelle2 Tabelle1 Schulname Schulformen Zuständigkeit Abendgymnasium St.Georg Mitte Abendgymnasium vor dem Holstentor Gy Adolph-Diesterweg-Schule,http://www.hamburg.de/contentblob/66932/data/zustaendigkeit-rebus-schulen.xls
g ,hamburg.de,Schuljahreserhebung 2013,XLSX,"Behörde für Schule und Berufsbildung, Referat Datenmanagement, Sachgebiet Datenerhebung und -bereitstellung - Klassen in allgemeinbildeneden Schulen ( ohne Sekundarstufe II und Erwachsenenbildung im Schuljahr 2013-14",,nicht bekannt,,,,,x,,,,,,,,,,,,,,,,,,,,,http://www.hamburg.de/contentblob/4262818/data/as-klassen-2013-excel.xlsx
g ,hamburg.de,Bericht 1. Halbjahr 2013 (Excel-Dokument),XLSX,Bericht über die von den hamburgischen Mehrheitsbeteiligungen aus dem Zuständigkeitsbereich der Behörde für Stadtentwicklung und Umweltgeleisteten Spenden und Spendenähnliche Zuwendungen ab 2.500 Euro im Einzelwert,,nicht bekannt,,,,,,x,x,,,,,,,,x,,,,,,,,,,,http://www.hamburg.de/contentblob/4113132/data/bsu-spendenbericht-1-halbjahr-2013.xlsx
g ,hamburg.de,Excel,XLS,"Behörde für Schule und Berufsbildung, Referat Datenmanagement - V 12 -, Sachgebiet Datenerhebung und Bereitstellung - V 122 - Schülerinnen und Schüler in privaten Schulen im Schuljahr 2012-23",,nicht bekannt,,,,,x,,,,,,,,,,,,,,,,,,,,,http://www.hamburg.de/contentblob/3894914/data/berufsbildend-privat-excel.xls
d,hamburg.de,Kraftfahrzeuge in Hamburg,XLS,"KFZ in Hamburg, dargstellt nach PKW und LKW, mit und ohne Anhänger, nach Gewicht und Hubraum, Zulassungen und Bestand sowie in einer Zeitreihe.",,dl-de-by-1.0,,"Statistisches Amt für Hamburg und Schleswig-Holstein, Vertrieb des Statistikamts Nord",,,,,,,,,,,,,,x,,,,,,,,,,http://www.statistik-nord.de/daten/
g ,hamburg.de,Zeitreihe Schulen01-09,XLS,Anzahl staatlicher und nicht staatlicher Schulen in Hamburg 2001 bis 2009,,nicht bekannt,,,,,x,,,,,,,,,,,,,,,,,,,,,https://www.hamburg.de/contentblob/1163022/data/ex-zahl-schulen-2001-2009.xls
b ,hamburg.de,Konzernbilanz und Ergebnisrechnung 2007 - hamburg.de ...,XLS,Konzernabschluss 2008 / Konzernbilanz,,nicht bekannt,,Freie und Hansestadt Hamburg,,,,x,,,,,,,,,,,,,,,,,,,Title: Konzernbilanz und Ergebnisrechnung 2007 Subject: Geschäftsbericht der FHH Author: Stefanie Scholz Created Date: 11/7/2008 12:20:40 PM Manager,http://www.hamburg.de/contentblob/2056680/data/konzernabschluss-2008-langfassung.xls
g ,hamburg.de,Bericht 2. Halbjahr 2013,XLSX,"Bericht der Behörde für Wirtschaft, Verkehr und Innovation über Zuwendungen in Form von Sponsoring, Spenden und mäzenatischen Schenkungen",,nicht bekannt,,,,,,x,,,,,,,,,,,,,,x,,,,,,http://www.hamburg.de/contentblob/4262448/data/bwf-sponsoringbericht-2-halbjahr-2013.xlsx
g ,hamburg.de,Jahresabschluss 2007 Kurzfassung,XLS,Kurzbilanz 2007,,nicht bekannt,,,,,,x,,,,,,,,,,,,,,,,,,,,http://www.hamburg.de/contentblob/860984/data/jahresabschluss-2007-kurz.xls
b ,hamburg.de,www.hamburg.de,XLS,Schüler/ Schülerinnen in staatlichen beruflichen Schulen in Hamburg im Schuljahr 2007/2008,,nicht bekannt,,Herbsterhebung mit Stichtag 21.9.2007,,,x,,,,,,,,,,,,,,,,,,,,Author: rayietur Last modified by: rayietur Created Date: 12/10/2007 3:04:38 PM Company: Freie und Hansestadt Hamburg Other titles: Deckblatt Seite 0 Übersicht ...,http://www.hamburg.de/contentblob/349210/data/ex-zahl-schueler-berufl-schulen-2007-08.xls
g ,hamburg.de,,XLS,"Gestorbene infolge ausgewählter bösartiger Neubildungen nach Geschlecht, Hamburg, 2008",2008,nicht bekannt,,Statistisches Amt für Hamburg und Schleswig-Holstein; eigene Berechnungen ,x,,,,,,,,x,,,,,,,,,,,,,,,http://www.hamburg.de/contentblob/1962814/data/tab-3-77-2008.xls
g ,hamburg.de,Tab-3.77-2003,XLS,"Gestorbene infolge ausgewählter bösartiger Neubildungen nach Geschlecht, Hamburg, 2003",,nicht bekannt,,Statistisches Amt für Hamburg und Schleswig-Holstein; eigene Berechnungen,,,,,,,,,x,,,,,,,,,,,,,,,http://www.hamburg.de/contentblob/1336174/data/tab-3-77-2003.xls
g ,hamburg.de,,XLS,"Nichtdeutsche Bevölkerung nach Alter und Geschlecht, Hamburg, 2009",2009,nicht bekannt,,Statistisches Amt für Hamburg und Schleswig-Holstein; eigene Berechnungen,,x,,,,,,,,,,,,,,,,,,,,,,http://www.hamburg.de/contentblob/2481952/data/tab-2-4-2009.xls
d,hamburg.de,Organigramm des Bezirksamtes Eimsbüttel (aktuell),PDF,Organigramm des Bezirksamtes Eimsbüttel.,,dl-de-by-1.0,,"Bezirksämter, Bezirksamt Eimsbüttel",,,,x,,,,,,,,,,,,,,,,,x,,,http://www.hamburg.de/eimsbuettel/
g ,hamburg.de,,XLS,"Gestorbene infolge vorsätzlicher Selbstbeschädigung (Suizidsterbefälle) nach Alter und Geschlecht, Hamburg, 2012",2012,nicht bekannt,,Statistisches Amt für Hamburg und Schleswig-Holstein; eigene Berechnungen,,x,,,,,,,x,,,,,,,,,,,,,,,http://www.hamburg.de/contentblob/4107488/data/tab-3-88-2012.xls
b ,hamburg.de,www.hamburg.de,XLSX,Gesamtübersicht der Schülerinnen und Schüler (staatlich und nicht-staatlich) der Schuljahre 2011/12 und 2012/13 und ihre Differenz,,nicht bekannt,, Herbststatistik 2011 u. 2012,,,x,,,,,,,,,,,,,,,,,,,,49905 7440 57345 50364 7439 57803 459 9.1974752028854828e-3-1-1.3440860215053763e-4 458 7.9867468829017355e-3. 945 945 282 282-663-0.70158730158730154 0 0-663,http://www.hamburg.de/contentblob/3834194/data/vergleich-schueler.xlsx
g ,hamburg.de,Excel,XLS,Schulabgängerinnen und Schulabgänger aus Hamburger allgemein bildenden Schulen im Schuljahr 2006/ 07,,nicht bekannt,,,,,x,,,,,,,,,,,,,,,,,,,,,http://www.hamburg.de/contentblob/1161900/data/ex-zahl-schulabgaenger-2006-07.xls
g ,hamburg.de,,XLS,"Vermeidbare Sterbefälle nach ausgewählten Diagnosen und Geschlecht, Hamburg, 2010",2010,nicht bekannt,,Statistisches Amt für Hamburg und Schleswig-Holstein; eigene Berechnungen,,x,,,,,,,x,,,,,,,,,,,,,,,http://www.hamburg.de/contentblob/3064030/data/tab-3-13-2010.xls
g ,hamburg.de,,XLS,"Nichtdeutsche Bevölkerung nach Alter und Geschlecht, Hamburg, 2012",2012,nicht bekannt,,Statistisches Amt für Hamburg und Schleswig-Holstein; eigene Berechnungen,,x,,,,,,,,,,,,,,,,,,,,,,http://www.hamburg.de/contentblob/4107522/data/tab-2-4-2012.xls
g ,hamburg.de,Deckblatt,XLS,Freie und Hansestadt Hamburg - Behörde für Bildung und Sport - Referat für Unternehmensdaten und Statistik - Sachgebiet Statistik - Private berufliche Schulen in Hamburg im Schuljahr 2007-2008,,nicht bekannt,,,,,x,,,,,,,,,,,,,,,,,,,,,http://www.hamburg.de/contentblob/349210/data/zahl-schueler-berufl-schulen-2007-08-ex.xls
d,hamburg.de,Integrierte Stadtteilentwicklung - RISE - Fördergebiete in Hamburg,"GML,WMS,PDF,DATA","Die Karte zeigt die Fördergebiete des Hamburger Rahmenprogramms Integrierte Stadtteilentwicklung (RISE). RISE bildet das programmatische Dach der Städtebauförderung auf der Landesebene. Es umfasst die Gebiete der Bund-Länder-Städtebauförderung in den Programmbereichen Städtebauliche Sanierung, Stadtumbau West, Aktive Stadt- und Ortsteilzentren, Städtebaulicher Denkmalschutz und Soziale Stadt sowie landesfinanzierte Fördergebiete. Weitere Informationen: <a href=""http://www.hamburg.de/rise"" target=""_blank"">www.hamburg.de/rise</a>",,dl-de-by-1.0,,"Behörde für Stadtentwicklung und Umwelt, Amt für Wohnen, Stadterneuerung und Bodenordnung",,,,,x,x,,,,,,,,,,,,,,,,,,http://www.hamburg.de/rise
d,hamburg.de,Naturdenkmale in Hamburg,"GML,WMS","Die Naturdenkmale des Nationalparks werden als Vektorkoordinaten gemäß Koordinatensystem EPSG::25832 bereitgestellt.
Als Naturdenkmal können Einzelschöpfungen der Natur, deren besonderer Schutz aus wissenschaftlichen, naturgeschichtlichen oder landeskundlichen Gründen oder wegen ihrer Seltenheit, Eigenart oder Schönheit erforderlich ist, ausgewiesen werden. Als Einzelschöpfungen der Natur gelten insbesondere alte oder seltene Bäume und Baumgruppen, erdgeschichtliche Aufschlüsse, Gletscherspuren, Findlinge, Quellen, Gewässer, Dünen, Bracks, Tümpel und Moore.",,dl-de-by-1.0,,"Behörde für Stadtentwicklung und Umwelt, Amt für Natur- und Ressourcenschutz",,,,,,,,,,,,,x,,,,,,,,,,,http://www.hamburg.de/naturschutz/147492/naturdenkmale.html
g ,hamburg.de,vorherige Schulen,XLS,Liste von Schulen mit Schulnummern,,nicht bekannt,,,,,x,,,,,,,,,,,,,,,,,,,,,http://www.hamburg.de/contentblob/2834484/data/vorherige-schulen.xls
g ,hamburg.de,allgemeinbildende Schulen » (VND.MS-EXCEL,XLS,Foerderungsverzeichnis,,nicht bekannt,,,,,x,,,,,,x,,,,,,,,,,,,,,,http://www.hamburg.de/contentblob/2834448/data/foerderungen.xls
g ,hamburg.de,Der Haushaltsplan 2007/8 als Excel-Datei,XLS,Haushaltsplan,,nicht bekannt,,,,,,x,,,,,,,,,,,,,,,,,,,,http://www.hamburg.de/contentblob/24082/data/haushaltsplan-excel-2007-8.xls
g ,hamburg.de,Tabelle1,XLSX,"Bericht der Behörde für Schule und Berufsbildung über Zuwendungen in Form von Sponsoring, Spenden und mäzenatischen Schenkungen",,nicht bekannt,,,,,x,x,,,,,,,,,,,,,,,,,,,,http://www.hamburg.de/contentblob/4269360/data/bsb-sponsoringbericht-2-halbjahr-2013.xlsx
g ,hamburg.de,allgemeinbildende Schulen » (VND.MS-EXCEL,XLS,Herkunftsländer,,nicht bekannt,,,,,x,,,,,,,,,,,,,,,,,,,,,http://www.hamburg.de/contentblob/2834454/data/herkunftslaender.xls
g ,hamburg.de,,XLS,"Gestorbene infolge vorsätzlicher Selbstbeschädigung (Suizidsterbefälle) nach Alter und Geschlecht, Hamburg, 2008",2008,nicht bekannt,,Statistisches Amt für Hamburg und Schleswig-Holstein; eigene Berechnungen ,x,,,,,,,,x,,,,,,,,,,,,,,,http://www.hamburg.de/contentblob/1962820/data/tab-3-88-2008.xls
g ,hamburg.de,Tabelle,XLS,"Verletzungen und Vergiftungen nach Geschlecht, Hamburg, Zeitvergleich",,nicht bekannt,,Statistisches Amt für Hamburg und Schleswig-Holstein; eigene Berechnungen,,x,,,,,,,x,,,,,,,,,,,,,,,http://www.hamburg.de/contentblob/3599776/data/tab-3-110-2012.xls
g ,hamburg.de,,XLS,"Bevölkerung nach Alter und Geschlecht, Hamburg, 2002",2002,nicht bekannt,,Statistisches Amt für Hamburg und Schleswig-Holstein: Bevölkerungsstatistik,,x,,,,,,,,,,,,,,,,,,,,,,http://www.hamburg.de/contentblob/1333798/data/tab-2-3-2002.xls
d,hamburg.de,Bebauungsplan Groß-Borstel 18 Hamburg,PDF,"Der Bebauungsplan Groß Borstel 18 für den Geltungsbereich östlich Klotzenmoor/westlich des Naturschutzgebiets Eppendorfer Moor (Bezirk Hamburg-Nord, Ortsteil 406) wird festgestellt.
Das Gebiet wird wie folgt begrenzt:
Klotzenmoor-Klotzenmoorstieg-über das Flurstück 175, Westgrenze des Flurstücks 169, über die Flurstücke 169 und 175 der Gemarkung Groß Borstel-Rathbusch-Weg Nr. 173-über das Flurstück 5 der Gemarkung Eppendorf.",,dl-de-by-1.0,,Landesbetrieb Geoinformation und Vermessung (LGV) Hamburg,,,,,x,x,,,,,,,,,,,,,,,,,,http://www.hamburg.de/bebauungsplaene-online.de
d,hamburg.de,Landesrecht online Hamburg,PDF,"Die Seite ""Landesrecht online"" bietet Ihnen die Möglichkeit, online in den Hamburger Rechtsvorschriften (Gesetze, Verordnungen etc.) zu recherchieren. Es stehen Ihnen sowohl Suchfunktionen als auch ein alphabetischer Zugang zur Verfügung.",,dl-de-by-1.0,,Behörde für Justiz und Gleichstellung,,,,,,,,,,,,,,,,,x,,,,,,,http://www.hamburg.de/justizbehoerde/
d,hamburg.de,Haushaltsplan Hamburg 2007/2008,XLS,"Die bereit gestellte Excel-Datei enthält alle Einnahme- und Ausgabetitel des Doppelhaushalts für die Haushaltsjahre 2007 und 2008. Angegeben werden je Titel u.a. veranschlagter Betrag, Zweckbestimmung, Gruppierung, Funktion, Planwert des Vorjahres und Ist-Ergebnisse zweier Vorjahre. Die Datei bietet neben dem Rohmaterial flexible Auswahlmöglichkeiten über eine Pivot-Tabelle.
Hinweise:
A) Der vollständige Haushaltsplan mit Übersichten und Erläuterungen wird auch im PDF-Format bereitgestellt (siehe URL zu weiteren Informationen über den Datensatz).
B) Änderungen, die nach Verabschiedung des Haushaltsplans durch die Bürgerschaft auf dem Wege der Nachbewilligung vorgenommen wurden, sind nicht erfasst.",,dl-de-by-1.0,,Finanzbehörde,,,,x,,,,,,,,,,,,,,,,,x,,,http://www.hamburg.de/fb/haushalt/
b ,hamburg.de,www.hamburg.de,XLS,Schulentlassene des Schuljahres 2010/11 aus Hamburger allgemeinbildenden Schulen1),,nicht bekannt,,Herbststatistik 2011,,,x,,,,,,,,,,,,,,,,,,,,163 667 830. 4 41 943 988. 51 143 134 328. 1 5 162 168. 171 927 1276 119 1393 3886. 9 11 6 26. 63 446 509. 390 5.7906458797327393e-2 1783 0.26473645137342244 2524 0 ...,http://www.hamburg.de/contentblob/3393096/data/schulentlassene-allgb.xls
d,hamburg.de,Abfallentsorgungsanlagen Hamburg,GML,"Abfallentsorgungsanlagen sind ortsfest errichtete und betriebene Entsorgungsanlagen zum Umschlag, zur zeitweiligen Lagerung und/oder zur Behandlung von Abfällen. Aufgrund ihrer Leistungsgrenzen bzw. Anlagengröße, v.a. hinsichtlich Durchsatz- und Gesamtlagerkapazität, werden sie nach dem Bundes-Immissionsschutzgesetz (BImSchG) beantragt und genehmigt. Änderungen an der Lage, der Beschaffenheit oder dem Betrieb müssen bei der Behörde für Stadtentwicklung und Umwelt - Abteilung Abfallwirtschaft - rechtzeitig angezeigt oder, je nach Auswirkung, beantragt werden.
Einen Sonderfall bilden die Errichtung und der Betrieb von Deponien sowie deren Änderungen. Sie benötigen eine Planfeststellung bzw. Plangenehmigung nach dem Kreislaufwirtschaftsgesetz (KrWG) oder eine Anzeige.",,dl-de-by-1.0,,"Behörde für Stadtentwicklung und Umwelt, Amt für Umweltschutz",,,,,,,,,,,,,x,,,,,,,,,,,http://www.hamburg.de/anlagen-bs/
d,hamburg.de,Schüler- und Klassenzahlen an Hamburger allgemeinbildenden Schulen,WEB,"Die Schüler- und Klassenzahlen an Hamburger Schulen werden jeweils zu Beginn des Schuljahres im Herbst erhoben. Die Zahlen - aggregiert nach Schulform, Schul- oder Jahrgangsstufe - können pro Bezirk, Stadtteil oder Schule ausgegeben werden. Sie können in Form einer Excel- oder pdf-Datei heruntergeladen werden.",,dl-de-by-1.0,,"Behörde für Schule und Berufsbildung, Amt für Verwaltung, Referat V 12 (Datenmanagement)",,,x,,,,,,,,,,,,,,,,,,,,,http://www.hamburg.de/schulstatistiken
g ,hamburg.de,allgemeinbildende Schulen » (VND.MS-EXCEL,XLS,Staatsangehörigkeit,,nicht bekannt,,,,,x,,,,,,,,,,,,,,,,,,,,,http://www.hamburg.de/contentblob/2834478/data/staatsangehoerigkeiten.xls
d,hamburg.de,Denkmalliste Hamburg,XML,"Denkmalliste nach § 6 Absatz 1 Hamburgisches Denkmalschutzgesetz vom 05. April 2013, (HmbGVBl S. 142)
Hinweis: Die Denkmalliste besitzt nachrichtlichen Charakter.

Die Denkmalliste enthält die Adressen, Bauwerksinformationen und Koordinaten der Denkmäler in Hamburg, soweit bekannt. Bewegliche Denkmäler und Bodendenkmäler sind nicht aufgeführt.",,dl-de-by-1.0,,,,,,,x,x,,,,,,,,,,,,,,,,,,http://www.hamburg.de/kulturbehoerde/denkmalschutzamt
g ,hamburg.de,,XLS,"Vermeidbare Sterbefälle nach ausgewählten Diagnosen und Geschlecht, Hamburg, 2009",2009,nicht bekannt,,Statistisches Amt für Hamburg und Schleswig-Holstein; eigene Berechnungen,,x,,,,,,,,,,,,,,,,,,,,,,http://www.hamburg.de/contentblob/2481962/data/tab-3-13-2009.xls
g ,hamburg.de,,XLS,Vollstationäre Krankenhausfälle (Wohnort Hamburg); 2007,2007,nicht bekannt,,Krankenhausdiagnosestatistik der BSG; eigene Berechnungen    ,,,,,,,,,x,,,,,,,,,,,,,,,http://www.hamburg.de/contentblob/1336090/data/tab-3-25-2007.xls
g ,hamburg.de,Tabelle,XLS,"Säuglingssterbefälle, Hamburg, im Zeitvergleich",,nicht bekannt,,Statistisches Amt für Hamburg und Schleswig-Holstein; eigene Berechnungen,,x,,,,,,,x,,,,,,,,,,,,,,,http://www.hamburg.de/contentblob/3599834/data/tab-3-53-2012.xls
g ,hamburg.de,,XLS,Vollstationäre Krankenhausfälle (Wohnort Hamburg); 2001,2001,nicht bekannt,,Krankenhausdiagnosestatistik der BSG; eigene Berechnungen    ,,x,,,,,,,x,,,,,,,,,,,,,,,http://www.hamburg.de/contentblob/1334134/data/tab-3-25-2001.xls
b ,hamburg.de,www.hamburg.de,XLS,Hamburger Schulstatistik im Überblick - Schuljahr 2008 und 2009,,nicht bekannt,,Freie und Hansestadt Hamburg - Behörde für Schule und Berufsbildung,,,x,,,,,,,,,,,,,,,,,,,,"Last modified by: Haackka Created Date: 12/12/2008 12:03:09 PM Company. Other titles: Deckblatt Herausgeber Inhalt Schulformen Schüler m,w Schüler staatl Schüler ...",http://www.hamburg.de/contentblob/1159806/data/ex-ueberblick-2008-09.xls
g ,hamburg.de,Das Zahlenwerk der Eröffnungsbilanz als,XLS,Eröffnungsbilanz der Freien und Hansestadt Hamburg zum 1. Januar 2006,,nicht bekannt,,,,,,x,x,,,,,,,,,,,,,,,,,,,http://www.hamburg.de/contentblob/23828/data/zahlenwerk-vollversion.xls
d,hamburg.de,Organigramm Personalamt (aktuell),PDF,Organigramm Personalamt,,dl-de-by-1.0,,Personalamt,,,,x,,,,,,,,,,,,,,,,,x,,,http://www.hamburg.de/personalamt
d,hamburg.de,Wassergütemessnetz und Biologisches Frühwarnsystem ( WGMN ),HTML,"Die Daten des Wassergütemessnetzes zur Qualität der Hamburger Gewässer stehen immer ""online"" im Internet zur Verfügung. Hier können alle Datensätze abgerufen werden, die dann graphisch angezeigt oder in Tabellenform ausgegeben werden. 

Der Online-Dienst ist zurzeit gebührenfrei, benötigt jedoch eine kostenlose Registrierung bei den HamburgServices. Anschließend ist das neue Angebot sofort verfügbar. Unter ""Wassergütemessnetz"" finden Sie dort die gespeicherten Daten der Parameter.

Warum ein Wassergütemessnetz: 
- Um akute Gewässerbelastungen bei Schadensfällen oder gar vorsätzlichen Gewässerverunreinigungen erfassen und so früh wie möglich reagieren zu können, betreibt das Institut für Hygiene und Umwelt, Hamburg Messstationen an allen wichtigen Fließgewässern (Elbe, Alster, Bille) in Hamburg. 
In den 9 Messstationen werden chemisch-physikalische Gütekenndaten automatisch und kontinuierlich erfasst.

- Die Erkennung von akuten toxischen Belastungen ist die Aufgabe von automatisch arbeitenden Biotestsystemen in 4 Messstationen (2 x Elbe, Bille, Wandse). Verschiedene Wasserorganismen zeigen im Wasser enthaltene Giftstoffe an. Dieses Biologische Frühwarnsystem (BFWS) kann mit Hilfe der kontinuierlichen biologischen Messungen plötzlich auftretende toxische Gewässerbelastungen frühzeitig erkennen, kurzfristige Gegenmaßnahmen ermöglichen und Hinweise zur Ermittlung der Verursacher geben. 

- Weiterhin gilt das System WGMN / BFWS als Präventivmaßnahme zur Verhinderung von grob fahrlässig oder vorsätzlich herbeigeführten Schadensfällen. 

- Ausführliche Informationen zum WGMN finden sich im Internet unter <a href=""http://www.wgmn.hamburg.de"">www.wgmn.hamburg.de</a>",,dl-de-by-1.0,,"Behörde für Gesundheit und Verbraucherschutz, Amt für Verbraucherschutz, Institut für Hygiene und Umwelt, Bereich Umweltuntersuchungen -HU4-",,,,,,,,,,,,,x,,,,,,,,,,,http://www.wgmn.hamburg.de
g ,hamburg.de,Einrichtungs-Liste,XLS,Liste von Einrichtungen,,nicht bekannt,,,,,,,x,x,,,,,,,,,,,,,,,,,,http://www.hamburg.de/contentblob/3417014/data/liste-einrichtungen.xls
g ,hamburg.de,,XLS,"Bevölkerung nach Alter und Geschlecht, Hamburg, 2005",2005,nicht bekannt,,Statistisches Amt für Hamburg und Schleswig-Holstein,,x,,,,,,,,,,,,,,,,,,,,,,http://www.hamburg.de/contentblob/1333810/data/tab-2-3-2005.xls
g ,hamburg.de,Schüler 2006_07,XLS,Freie und Hansestadt Hamburg - Behörde für Bildung und Sport - Referat für Unternehmensdaten und Statistik - Sachgebiet Statistik - Ergebnis der herbsterhebung: Schülerinnen und Schüler und Klassen nach Schulform und Klassenart in Hamburger allgemein bildenden Schulen im Schuljahr 2006-07,,nicht bekannt,,,,,x,,,,,,,,,,,,,,,,,,,,,http://www.hamburg.de/contentblob/349078/data/ex-zahl-kl-schueler-schulform-2006-07.xls
g ,hamburg.de,Zuwendungsbericht 2013 Zum Download Excel,XLSX,Zuwendungsbericht 2013,,nicht bekannt,,,,,,,x,,x,,,,,,,,,,,,,,,,,http://www.hamburg.de/contentblob/4284536/data/zuwendungsbericht-2013.xlsx
d,hamburg.de,Die Wohnungszahl Hamburgs und seiner Bezirke gemäß Zensus 2011,DATA,Die Wohnungszahl Hamburgs und seiner Bezirke gemäß Zensus 2011 im Vergleich zu den Wohnungszahlen der Volkszählung 1987 und der Wohnungsbestandsfortschreibung. Tiefer regional gegliederte Zahlen unterhalb der Bezirksebene können leider nicht auf der Basis der Zensusergebnisse zur Verfügung gestellt werden.,,dl-de-by-1.0,,"Statistisches Amt für Hamburg und Schleswig-Holstein, Vertrieb des Statistikamts Nord",,,,,x,x,,,,,,,,,,,,,,,,,,http://www.statistik-nord.de/daten/bevoelkerung-und-gebiet/bevoelkerungsstand-und-entwicklung/
g ,hamburg.de,,XLS,"Gestorbene infolge ausgewählter bösartiger Neubildungen nach Geschlecht, Hamburg, 2012",2012,nicht bekannt,,Statistisches Amt für Hamburg und Schleswig-Holstein; eigene Berechnungen,,x,,,,,,,x,,,,,,,,,,,,,,,http://www.hamburg.de/contentblob/4107490/data/tab-3-77-2012.xls
b ,hamburg.de,www.hamburg.de,XLS,Zahlenwerk,,nicht bekannt,,,,,,x,,,,,,,,,,,,,,,,,,,,http://www.hamburg.de/contentblob/3275464/data/zahlenwerk.xls
g ,hamburg.de,schulgenaue Zusammenfassung,XLS,Freie und Hansestadt Hamburg - Behörde für Bildung und Sport - Referat für Unternehmensdaten und Statistik - Sachgebiet Statistik - Staatlich berufliche Schulen:Schulen und Schüler,,nicht bekannt,,,,,x,,,,,,,,,,,,,,,,,,,,,http://www.hamburg.de/contentblob/349218/data/ex-zahl-berufl-schueler-2006-07.xls
d,hamburg.de,Organigramm der Kulturbehörde (aktuell),PDF,Organigramm der Kulturbehörde,,dl-de-by-1.0,,Kulturbehörde,,,,x,,,,,,,,,,,,,,,,,x,,,http://www.hamburg.de/kulturbehoerde
g ,hamburg.de,,XLS,"Nichtdeutsche Bevölkerung nach Alter und Geschlecht, Hamburg, 2010",2010,nicht bekannt,,Statistisches Amt für Hamburg und Schleswig-Holstein; eigene Berechnungen,,x,,,,,,,,,,,,,,,,,,,,,,http://www.hamburg.de/contentblob/3064014/data/tab-2-4-2010.xls
g ,hamburg.de,Herbststatistik 2011,XLS,Absolventen und Abbrecher in Hamburger berufsbildenden Schulen im Schuljahr 2010/11,,nicht bekannt,,,,,x,,,,,,,,,,,,,,,,,,,,,https://www.hamburg.de/contentblob/3393098/data/absolventen-berufsb.xls
d,hamburg.de,"Lärmminderungsplanung, Fluglärm Hamburg","GML,WMS","- Erstellung des Lärmaktionsplanes nach Umgebungslärmrichtlinie
- Berechnung und Ausweisung der Fluglärmschutzzonen inklusive Isolinien nach dem neuen Fluglärmgesetz
- Überwachung der Einhaltung von Nachtflugbeschränkungen und Erteilung von Ausnahmegenehmigungen
- Fluglärmbeschwerdemanagement",,dl-de-by-1.0,,"Behörde für Stadtentwicklung und Umwelt, Amt für Immissionsschutz und Betriebe",,,,,,,,,,,,,x,,,,,,,,,,,http://www.hamburg.de/fluglaerm
