Bevölkerung,Bildung und Wissenschaft,"Geographie, Geologie und Geobasisdaten",Gesetze und Justiz,Gesundheit,"Infrastruktur, Bauen und Wohnen","Kultur, Freizeit, Sport, Tourismus",Politik und Wahlen,Soziales,Transport und Verkehr,Umwelt und Klima,Verbraucherschutz,"Öffentliche Verwaltung, Haushalt und Steuern",Wirtschaft und Arbeit,Sonstiges,Noch nicht kategorisiert,Dateibezeichnung,URL,Lizenz,Format,Quelle
,,,,,,,,,,,,x,,,,Zugriffsstatistiken von moers.de für Juni 2014,http://www.moers.de/C1257221003C7526/html/05EB762055330229C1257D0A003E6914?OpenDocument,dl-de-zero-2.0,ZIP,d
,,,,,,,,,,,,x,,,,Haushaltsplanentwurf 2014,http://www.moers.de/C1257221003C7526/html/5775CA1DE62C50A8C1257C9100355E33?OpenDocument,dl-de-zero-2.0,XML,d
,,,,,,,x,,,,,,,,,Wahlergebnis der Bundestagswahl 2009 für das Moerser Stadtgebiet,http://www.moers.de/C1257221003C7526/html/A3997F1C8C859BD6C1257C0500234A6F?OpenDocument,dl-de-zero-2.0,CSV,d
x,,,,,,,,,,,,,,,,Bevölkerung in den Sozialatlasbezirken nach Migrationshintergrund 2011,http://www.moers.de/C1257221003C7526/html/2C5514779846D7B3C1257B0F00309C2E?OpenDocument,dl-de-zero-2.0,CSV,d
,,,,,,x,,,,,,,,,,Schulen und Bildungseinrichtungen,http://www.moers.de/C1257221003C7526/html/8D0B93A9D5953BBCC1257B12003C107F?OpenDocument,dl-de-zero-2.0,XSP,d
,,,,,,x,,,,,,,,,,Teilnehmer nach Instrumenten in der Moerser Musikschule im Schuljahr 2012/2013,http://www.moers.de/C1257221003C7526/html/1A4FCFFDCA8733F0C1257C7E0030D8F9?OpenDocument,dl-de-zero-2.0,CSV,d
,,x,,,,,,,,,,,,,,Grünflächen in bebauten Ortslagen,http://www.moers.de/C1257221003C7526/html/F873FD90317F25A8C1257C8200454A43?OpenDocument,dl-de-zero-2.0,JSON,d
,,,,,,,x,,,,,,,,,Wahlergebnis der Europawahl 2009 für das Moerser Stadtgebiet,http://www.moers.de/C1257221003C7526/html/3C06B59FE72A75EBC1257C21002AE4E1?OpenDocument,dl-de-zero-2.0,CSV,d
,,,,,,x,,,,,,,,,,Bildungsträger,http://www.moers.de/C1257221003C7526/html/3933F03023F7BC37C1257B120048D496?OpenDocument,dl-de-zero-2.0,XSP,d
,,,,,,,,,,,,x,,,,Telefonbuch der Stadtverwaltung,http://www.moers.de/C1257221003C7526/html/64B726239A5CCADDC1257B0F0033F2BB?OpenDocument,dl-de-zero-2.0,XML,d
,,,,,,,x,,,,,,,,,Wahlergebnis der Landtagswahlen 1980 - 2012 für das Moerser Stadtgebiet,http://www.moers.de/C1257221003C7526/html/97DA84679F51B49FC1257D4E003BA5E3?OpenDocument,dl-de-zero-2.0,CSV,d
x,,,,,,,,,,,,,,,,Bürgerumfrage 50plus,http://www.moers.de/C1257221003C7526/html/B156509C0293CB58C1257CB50046D844?OpenDocument,dl-de-zero-2.0,CSV,d
,,,,,,,x,,,,,,,,,Wahlergebnis der Landtagswahl 2010 für das Moerser Stadtgebiet,http://www.moers.de/C1257221003C7526/html/232D54FE7CD03E23C1257C21002BF0A0?OpenDocument,dl-de-zero-2.0,CSV,d
x,,,,,,,,,,,,,,,,Bevölkerung in den Sozialatlasbezirken nach Migrationshintergrund 2012,http://www.moers.de/C1257221003C7526/html/1861FFEFC3355A26C1257B2D00296A5A?OpenDocument,dl-de-zero-2.0,CSV,d
,,,,,,x,,,,,,,,,,Geplantes und durchgeführtes Programm 2011 und 2012 der VHS,http://www.moers.de/C1257221003C7526/html/19B41ABD9FA33447C1257C6D003B3E97?OpenDocument,dl-de-zero-2.0,CSV,d
,,,,,,,,,,,,x,,,,Stellenplan 2014,http://www.moers.de/C1257221003C7526/html/E2D5F900C911F33EC1257C98003660B0?OpenDocument,dl-de-zero-2.0,CSV,d
,,,,,,,,,,,,x,,,,Zugriffsstatistiken von moers.de für März 2014,http://www.moers.de/C1257221003C7526/html/AA8E1087B882E644C1257CAE00275995?OpenDocument,dl-de-zero-2.0,ZIP,d
,,,,,,,,,,,,x,,,,Zugriffsstatistiken von moers.de für Dezember 2013,http://www.moers.de/C1257221003C7526/html/86B851F2C6CB2A90C1257C75004FE86E?OpenDocument,dl-de-zero-2.0,ZIP,d
,,,,,,,,,,,,x,,,,Zugriffsstatistiken von moers.de für Mai 2013,http://www.moers.de/C1257221003C7526/html/4F9E79BA68252802C1257B8000299220?OpenDocument,dl-de-zero-2.0,ZIP,d
x,,,,,,,,,,,,,,,,Bevölkerung in den Sozialatlasbezirken nach Familienstand und Altersgruppen 2011,http://www.moers.de/C1257221003C7526/html/AEA3EA13DC77640DC1257B0F002FCAD8?OpenDocument,dl-de-zero-2.0,CSV,d
,,,,,,,x,,,,,,,,,Wahlbezirke in der Stadt Moers. Gliederung für die Kommunalwahl 2009 (Shape-Dateien),http://www.moers.de/C1257221003C7526/html/70CED379E3E937BEC1257C05002427E5?OpenDocument,dl-de-zero-2.0,ZIP,d
,,,,,,,,,,,,x,,,,Stellenübersicht nach Produktbereichen 2014,http://www.moers.de/C1257221003C7526/html/2AF884662E767A05C1257C980033910F?OpenDocument,dl-de-zero-2.0,CSV,d
,,,,,,,,,,,,x,,,,Zugriffsstatistiken von moers.de für August 2014,http://www.moers.de/C1257221003C7526/html/6C3B62F3E09068B2C1257D470025EAB0?OpenDocument,dl-de-zero-2.0,ZIP,d
,,,,,,x,,,,,,,,,,Schüler/innen (gesamt) und gebildete Klassen an den Schulen der Stadt Moers im Schuljahr 2012/13,http://www.moers.de/C1257221003C7526/html/3E2F254DFDA609AFC1257B8800333B41?OpenDocument,dl-de-zero-2.0,CSV,d
,,,,,,x,,,,,,,,,,Veranstaltungen nach Datum,http://www.moers.de/C1257221003C7526/html/680ACCBD7C34F214C1257B0C004A65F2?OpenDocument,dl-de-zero-2.0,XSP,d
x,,,,,,,,,,,,,,,,Bevölkerung in den Sozialatlasbezirken 2012,http://www.moers.de/C1257221003C7526/html/F1F681BA4F49B6DEC1257B800045961A?OpenDocument,dl-de-zero-2.0,CSV,d
x,,,,,,,,,,,,,,,,Beliebte Vornamen für Neugeborene 2013,http://www.moers.de/C1257221003C7526/html/17821D658E239C2EC1257C36003D0934?OpenDocument,dl-de-zero-2.0,CSV,d
,,,,,,,,,,,,x,,,,Zugriffsstatistiken von moers.de für Januar 2013,http://www.moers.de/C1257221003C7526/html/F191251AD640E087C1257B10004AC4DE?OpenDocument,dl-de-zero-2.0,ZIP,d
,,,,,,,x,,,,,,,,,Wahlbezirke der Stadt Moers. Gliederung für die Kommunalwahl 2014 (Shape-Dateien),http://www.moers.de/C1257221003C7526/html/D731C4E5D1D179C3C1257C070032F1BC?OpenDocument,dl-de-zero-2.0,ZIP,d
,,,,,,,,,,,,x,,,,Zugriffsstatistiken von moers.de Juli 2013,http://www.moers.de/C1257221003C7526/html/5231525492889A87C1257BD3002D600A?OpenDocument,dl-de-zero-2.0,ZIP,d
,,,,,,,x,,,,,,,,,Wahlergebnis der Landrats- und Kreistagswahlen von 1984 bis 2014 für das Moerser Stadtgebiet,http://www.moers.de/C1257221003C7526/html/83C5550A130037BDC1257CF50036714E?OpenDocument,dl-de-zero-2.0,CSV,d
x,,,,,,,,,,,,,,,,Frauenanteil in den Sozialatlasbezirken nach Altersstruktur (7 Gruppen) 2011,http://www.moers.de/C1257221003C7526/html/20A518D734DF8DE1C1257B0F002F73EE?OpenDocument,dl-de-zero-2.0,CSV,d
,,,,,,,x,,,,,,,,,Wahlergebnis der Bundestagswahlen 1983 - 2013 für das Moerser Stadtgebiet,http://www.moers.de/C1257221003C7526/html/5FBA9C9D4EEFC9C5C1257C0E002529A0?OpenDocument,dl-de-zero-2.0,CSV,d
,,,,,,,,,,,,,,x,,"Straßenverzeichnis der Stadt Moers nach Stadtteilen, Wohnplätzen und Postleitzahlengebieten (bis 23.02.2014)",http://www.moers.de/C1257221003C7526/html/2700D83AD946CA18C1257B13002AA63E?OpenDocument,dl-de-zero-2.0,CSV,d
,,,,,,,,,,,,,,x,,Wetterdaten der privaten Wetterstation in Moers-Utfort,http://www.moers.de/C1257221003C7526/html/6BC8F7F86079065DC1257D1F00264DF2?OpenDocument,other-open,"XML,JSON,TXT",d
,,,,,,x,,,,,,,,,,Gliederung nach Veranstaltungsformen der VHS 2012,http://www.moers.de/C1257221003C7526/html/FFE64B8876FD3913C1257C6D003F85C3?OpenDocument,dl-de-zero-2.0,CSV,d
,,,,,,x,,,,,,,,,,Entwicklung der Erstwunschquote zu den weiterführenden Schulen für das Schuljahr 2014/15,http://www.moers.de/C1257221003C7526/html/0AC063A80CF066D1C1257CB300593151?OpenDocument,dl-de-zero-2.0,CSV,d
x,,,,,,,,,,,,,,,,Beliebte Vornamen für Neugeborene 2012,http://www.moers.de/C1257221003C7526/html/4FB51B7FFFBC72C3C1257B5C00307499?OpenDocument,dl-de-zero-2.0,CSV,d
,,,,,,x,,,,,,,,,,Entwicklung des Unterrichtsangebotes der Moerser Musikschule,http://www.moers.de/C1257221003C7526/html/45C79C8A9EFCB54FC1257C7E002D09AD?OpenDocument,dl-de-zero-2.0,CSV,d
x,,,,,,,,,,,,,,,,Bevölkerung in den Sozialatlasbezirken nach Geschlecht 2012,http://www.moers.de/C1257221003C7526/html/10AE3A119E310F4BC1257B2D0028F135?OpenDocument,dl-de-zero-2.0,CSV,d
,,,,,,,,,,,,x,,,,Internetumfrage 2010,http://www.moers.de/C1257221003C7526/html/75B8650288BCAC0EC1257B1D00345832?OpenDocument,dl-de-zero-2.0,CSV,d
,,x,,,,,,,,,,,,,,Spielplätze in Moers,http://www.moers.de/C1257221003C7526/html/B239881271A68EB7C1257C8200602C53?OpenDocument,dl-de-zero-2.0,JSON,d
,,x,,,,,,,,,,,,,,Geschichtsstationen,http://www.moers.de/C1257221003C7526/html/CA124D13A5CBE85EC1257CE0002691C7?OpenDocument,dl-de-zero-2.0,"JSON,KML",d
,,,,,,x,,,,,,,,,,Sehenswürdigkeiten,http://www.moers.de/C1257221003C7526/html/054707004725BCCFC1257B0F003311A1?OpenDocument,dl-de-zero-2.0,XSP,d
x,,,,,,,,,,,,,,,,Bevölkerung in den Sozialatlasbezirken nach Altersstruktur (13 Gruppen) 2012,http://www.moers.de/C1257221003C7526/html/7EA32BEC483F8AC4C1257B25002E8C82?OpenDocument,dl-de-zero-2.0,CSV,d
,,,,,,,,,,,,x,,,,Zugriffsstatistiken von moers.de für Februar 2014,http://www.moers.de/C1257221003C7526/html/3C470D16DBA44E74C1257C9100295ED6?OpenDocument,dl-de-zero-2.0,ZIP,d
,,,,,,,x,,,,,,,,,Wahlergebnisse der Bürgermeister- und Stadtratswahlen von 1979 bis 2014 im Moerser Stadtgebiet,http://www.moers.de/C1257221003C7526/html/BCF1A6A0BF7B14D8C1257CF4002E612B?OpenDocument,dl-de-zero-2.0,CSV,d
,,,,,,x,,,,,,,,,,Zu- und Abgänge verschiedener Medientypen der Bibliothek,http://www.moers.de/C1257221003C7526/html/0D766C57AA9EFE86C1257C1D003AC6F4?OpenDocument,dl-de-zero-2.0,CSV,d
,,,,,,,x,,,,,,,,,Wahlergebnis der Bundestagswahl 2013 für das Moerser Stadtgebiet,http://www.moers.de/C1257221003C7526/html/C9474A67F1984310C1257C050023D45B?OpenDocument,dl-de-zero-2.0,CSV,d
x,,,,,,,,,,,,,,,,Bevölkerung in den Sozialatlasbezirken nach Wohnungsstatus 2012,http://www.moers.de/C1257221003C7526/html/B55B175FCA9496E1C1257B2D002A5981?OpenDocument,dl-de-zero-2.0,CSV,d
x,,,,,,,,,,,,,,,,Bevölkerung in den Sozialatlasbezirken nach Wohnungsstatus 2011,http://www.moers.de/C1257221003C7526/html/EC7B6ED6F009ED38C1257B0F00322570?OpenDocument,dl-de-zero-2.0,CSV,d
,,,,,,x,,,,,,,,,,Abmeldungen nach Instrumenten in der Moerser Musikschule 2012,http://www.moers.de/C1257221003C7526/html/291B41562BA976D8C1257C750051780B?OpenDocument,dl-de-zero-2.0,CSV,d
,,,,,,,,,,,,x,,,,Zugriffsstatistiken von moers.de für April 2014,http://www.moers.de/C1257221003C7526/html/4298B1D13CFA5DFFC1257CED002EF936?OpenDocument,dl-de-zero-2.0,ZIP,d
x,,,,,,,,,,,,,,,,Beliebte Vornamen für Neugeborene 2011,http://www.moers.de/C1257221003C7526/html/7D17DBDF5B33CAFDC1257B5C0030622A?OpenDocument,dl-de-zero-2.0,CSV,d
,,,,,,,,,,,,x,,,,Internetumfrage 2013,http://www.moers.de/C1257221003C7526/html/2C414C57404C4DC5C1257B1D00314C64?OpenDocument,dl-de-zero-2.0,CSV,d
x,,,,,,,,,,,,,,,,Bevölkerung in den Sozialatlasbezirken nach Geschlecht 2011,http://www.moers.de/C1257221003C7526/html/FBB8FD68158FAC6AC1257B0F003025AB?OpenDocument,dl-de-zero-2.0,CSV,d
,,,,,,x,,,,,,,,,,Kleingartenvereine,http://www.moers.de/C1257221003C7526/html/47D6D64DCE44FDF6C1257B0F003716C8?OpenDocument,dl-de-zero-2.0,XSP,d
,,,,,,,x,,,,,,,,,Straßenverzeichnis für die Kommunalwahl 2009,http://www.moers.de/C1257221003C7526/html/0E524548E6DC3091C1257B73002D0307?OpenDocument,dl-de-zero-2.0,CSV,d
,,,,,,x,,,,,,,,,,Besucher und Mitwirkende der Veranstaltungen der Moerser Musikschule 2012,http://www.moers.de/C1257221003C7526/html/D43771B07563576DC1257C7E002A7F51?OpenDocument,dl-de-zero-2.0,CSV,d
,,,,,,,,,,,,,,x,,Adressen,http://www.moers.de/C1257221003C7526/html/D4500872723983CCC1257B0B004CC944?OpenDocument,dl-de-zero-2.0,XSP,d
x,,,,,,,,,,,,,,,,Bevölkerung in den Sozialatlasbezirken nach Familienstand 2011,http://www.moers.de/C1257221003C7526/html/EFED288CB56E2F9AC1257B0B005AB247?OpenDocument,dl-de-zero-2.0,CSV,d
,,,,,,x,,,,,,,,,,Jahresrechnung der Moerser Musikschule 2012,http://www.moers.de/C1257221003C7526/html/8ABE37F5A1A403E2C1257C7E00300050?OpenDocument,dl-de-zero-2.0,CSV,d
,,,,,,,,,,,,x,,,,Zugriffsstatistiken von moers.de für Mai 2014,http://www.moers.de/C1257221003C7526/html/0A5CEF4D54E101A7C1257CED002FB5F1?OpenDocument,dl-de-zero-2.0,ZIP,d
,,,,,,,,,,,,x,,,,Wartezeiten Bürgerservice,http://www.moers.de/C1257221003C7526/html/6255084CF2B8082AC1257D33003E3B14?OpenDocument,dl-de-zero-2.0,"XML,HTML",d
,,,,,,,,,,,,x,,,,Zugriffsstatistiken von moers.de für Juni 2013,http://www.moers.de/C1257221003C7526/html/48A7578D244FCE3BC1257B9C0026DDE1?OpenDocument,dl-de-zero-2.0,ZIP,d
,,,,,,,,,,,,x,,,,Zugriffsstatistiken von moers.de für Januar 2014,http://www.moers.de/C1257221003C7526/html/284C0115C608B802C1257C75005081AD?OpenDocument,dl-de-zero-2.0,ZIP,d
,,,,,,,,,,,,x,,,,Zugriffsstatistiken von moers.de für August 2013,http://www.moers.de/C1257221003C7526/html/1C1135D68FC54A0FC1257BE1002FE191?OpenDocument,dl-de-zero-2.0,ZIP,d
,,,,,,,,,,,,x,,,,Städtische Beteiligungsgesellschaften,http://www.moers.de/C1257221003C7526/html/AED834349B75CC28C1257B12004BE8B1?OpenDocument,dl-de-zero-2.0,XSP,d
,,,,,,x,,,,,,,,,,Hotels- und Privatunterkünfte,http://www.moers.de/C1257221003C7526/html/EA59EBAB9D6FC156C1257B12003B70ED?OpenDocument,dl-de-zero-2.0,XSP,d
,,,,,,,,,,,,,,x,,"Straßenverzeichnis der Stadt Moers nach Stadtteilen, Wohnplätzen und Postleitzahlengebieten (aktuell)",http://www.moers.de/C1257221003C7526/html/258907DFF851B002C1257C890034E7DB?OpenDocument,dl-de-zero-2.0,CSV,d
,,,,,,x,,,,,,,,,,Vereine,http://www.moers.de/C1257221003C7526/html/11672ADBDB47E3E4C1257B120038BCB3?OpenDocument,dl-de-zero-2.0,XSP,d
x,,,,,,,,,,,,,,,,Bevölkerung in den Sozialatlasbezirken nach Familienstand 2012,http://www.moers.de/C1257221003C7526/html/203C9442CAF71A9BC1257B2D00279209?OpenDocument,dl-de-zero-2.0,CSV,d
,,,,,,,,,,,,x,,,,Dienstanweisung Social Media,http://www.moers.de/C1257221003C7526/html/9D70FE8154C8C1F3C1257D4800477122?OpenDocument,dl-de-zero-2.0,TXT,d
,,,,,,,,,,x,,,,,,Blumenampel,http://www.moers.de/c125722e0057acf2/files/blumenampel.json/$file/blumenampel.json?openelement,nicht bekannt,JSON,b
,x,,,,,,,,,,,,,,,Geschichtsstation,http://www.moers.de/c125722e0057acf2/files/geschichtsstation.kml/$file/geschichtsstation.kml?openelement,nicht bekannt,KML,b
x,,,,,,,,,,,,,,,,Bevölkerung in den Sozialatlasbezirken nach Altersstruktur (13 Gruppen) 2011,http://www.moers.de/C1257221003C7526/html/A74DC63BAFC82952C1257B0F002EF262?OpenDocument,dl-de-zero-2.0,CSV,d
,,,,,,x,,,,,,,,,,Zahlen und Daten der vhs in Kürze,http://www.moers.de/C1257221003C7526/html/5BB94D49FFA60E9AC1257D7A0048CC9E?OpenDocument,dl-de-zero-2.0,CSV,d
x,,,,,,,,,,,,,,,,Bevölkerung in den Sozialatlasbezirken nach Staatsangehörigkeit 2011,http://www.moers.de/C1257221003C7526/html/82B1B64B20B03956C1257B0F0030EA35?OpenDocument,dl-de-zero-2.0,CSV,d
,,,,,,,x,,,,,,,,,Wahlverzeichnis 2009 Kommunalwahl,http://www.moers.de/c125722e0057acf2/files/kw_2009_08_30.csv/$file/kw_2009_08_30.csv?openelement,nicht bekannt,CSV,b
,,x,,,,,,,,,,,,,,Radwandern: Baumkreisroute,http://www.moers.de/C1257221003C7526/html/09721270B206571AC1257CB0004795E8?OpenDocument,dl-de-zero-2.0,"GPX,KML,OVL,IKT,TCX,CRS",d
,,,,,,,,,,,,x,,,,Haushaltsplanentwurf 2015,http://www.moers.de/C1257221003C7526/html/6A22295A643548B9C1257D72004A3BE7?OpenDocument,dl-de-zero-2.0,XML,d
,,,,,,x,,,,,,,,,,Gliederung der durchgeführten Veranstaltungen der VHS nach Fachbereichen 2012,http://www.moers.de/C1257221003C7526/html/A293AAF631458EA6C1257C6D003E833B?OpenDocument,dl-de-zero-2.0,CSV,d
,,,,,,,x,,,,,,,,,Wahlergebnis der Europawahlen von 1984 bis 2014 für das Moerser Stadtgebiet,http://www.moers.de/C1257221003C7526/html/D67D6073C7502E06C1257CF50037D84C?OpenDocument,dl-de-zero-2.0,CSV,d
,,,,,,x,,,,,,,,,,Erstwunschverhalten an Moerser Schulen 2012/13,http://www.moers.de/C1257221003C7526/html/4F5AE7BD0D5FA538C1257B87004C66A8?OpenDocument,dl-de-zero-2.0,CSV,d
,,,,,,,,x,,,,,,,,Kinder- und Jugendeinrichtungen,http://www.moers.de/C1257221003C7526/html/7617E2A4F219D350C1257B0F003750A4?OpenDocument,dl-de-zero-2.0,XSP,d
x,,,,,,,,,,,,,,,,Bevölkerung in den Sozialatlasbezirken nach Staatsangehörigkeit 2012,http://www.moers.de/C1257221003C7526/html/1DB52DF276097B39C1257B2D0029EFA7?OpenDocument,dl-de-zero-2.0,CSV,d
,,,,,,x,,,,,,,,,,Angebotsentwicklung in Unterrichtseinheiten der VHS,http://www.moers.de/C1257221003C7526/html/CE6C549174ED0814C1257C6D004159E7?OpenDocument,dl-de-zero-2.0,CSV,d
,,,,,,x,,,,,,,,,,Teilnehmerbelegung nach Jahreswochenstunden von 1999 bis 2012,http://www.moers.de/C1257221003C7526/html/8598E181CF3ED35AC1257C7E003172BC?OpenDocument,dl-de-zero-2.0,CSV,d
,,,,,,,,,,,,x,,,,Zugriffsstatistiken von moers.de für September 2013,http://www.moers.de/C1257221003C7526/html/2D16E3173BDFC52FC1257C19003BF4B9?OpenDocument,dl-de-zero-2.0,ZIP,d
,,,,,,,,,,,,x,,,,Haushaltsplan 2013,http://www.moers.de/C1257221003C7526/html/B2DEA28118BBFC88C1257B0A0056F933?OpenDocument,dl-de-zero-2.0,XML,d
,,,,,,x,,,,,,,,,,Räumliche Verteilung der Veranstaltungen der VHS 2012,http://www.moers.de/C1257221003C7526/html/EEB4623F449E24C7C1257C6D00409DEC?OpenDocument,dl-de-zero-2.0,CSV,d
,,,,,,x,,,,,,,,,,Schüler/innen (gesamt) und gebildete Klassen an den Schulen der Stadt Moers im Schuljahr 2013/14,http://www.moers.de/C1257221003C7526/html/46AB003378B3EC41C1257C70004E2F4E?OpenDocument,dl-de-zero-2.0,CSV,d
,,,,,,x,,,,,,,,,,Besucher und Mitwirkende schulfremder Veranstaltungen der Moerser Musikschule,http://www.moers.de/C1257221003C7526/html/C6FDB58491655915C1257C7E002C09F6?OpenDocument,dl-de-zero-2.0,CSV,d
,,x,,,,,,,,,,,,,,Wohnplätze,http://www.moers.de/C1257221003C7526/html/F728A1AEE95E9E39C1257B120053DEFC?OpenDocument,dl-de-zero-2.0,"ZIP,PDF,JSON",d
,,x,,,,,,,,,,,,,,Standorte der Blumenampeln,http://www.moers.de/C1257221003C7526/html/861100D840479EADC1257C82004A9CFE?OpenDocument,dl-de-zero-2.0,JSON,d
,,,,,,x,,,,,,,,,,Anzahl der Ausleihen der Bibliothek,http://www.moers.de/C1257221003C7526/html/7E0C9FA18C24B822C1257C200038604D?OpenDocument,dl-de-zero-2.0,CSV,d
,,,,,,,,,,,,x,,,,Facebookumfrage 2014,http://www.moers.de/C1257221003C7526/html/DA6E796E232F83EBC1257C98002E9C1E?OpenDocument,dl-de-zero-2.0,CSV,d
,,,,,,,,,,,,x,,,,Zugriffsstatistiken von moers.de für April 2013,http://www.moers.de/C1257221003C7526/html/008A01483054B1BFC1257B7300307F49?OpenDocument,dl-de-zero-2.0,ZIP,d
,,,,,,,,,,,,x,,,,Pressemeldungen der Stadt Moers,http://www.moers.de/C1257221003C7526/html/343D2E253B126E77C1257D40004512E7?OpenDocument,dl-de-zero-2.0,XML,d
,,,,,,,,,,,,x,,,,Zugriffsstatistiken von moers.de für Juli 2014,http://www.moers.de/C1257221003C7526/html/979C0BF7820CDE04C1257D33002898FF?OpenDocument,dl-de-zero-2.0,ZIP,d
,,,,,,x,,,,,,,,,,Nutzende der Bibliothek nach Altersgruppen,http://www.moers.de/C1257221003C7526/html/962DECC2F2CADF1EC1257C200036F6A9?OpenDocument,dl-de-zero-2.0,CSV,d
x,,,,,,,,,,,,,,,,Beliebte Vornamen für Neugeborene 2010,http://www.moers.de/C1257221003C7526/html/716FF266F9373073C1257B5C0030523F?OpenDocument,dl-de-zero-2.0,CSV,d
,,,,,,,,,,,,,,x,,Übersichtskarte zur Autobahnanbindung von Moers,http://www.moers.de/C1257221003C7526/html/E6C6E5280E148B7EC1257D34004A0277?OpenDocument,dl-de-zero-2.0,TIF,d
x,,,,,,,,,,,,,,,,Bevölkerung in den Sozialatlasbezirken 2013,http://www.moers.de/C1257221003C7526/html/B9F7433A94EC202DC1257CA20034B041?OpenDocument,dl-de-zero-2.0,CSV,d
x,,,,,,,,,,,,,,,,Bevölkerung in den Sozialatlasbezirken nach Religionszugehörigkeit 2012,http://www.moers.de/C1257221003C7526/html/DD9501E24AA68D56C1257B2D0029ABB0?OpenDocument,dl-de-zero-2.0,CSV,d
x,,,,,,,,,,,,,,,,Bevölkerung in den Wohnplätzen ab 1980,http://www.moers.de/C1257221003C7526/html/8F61D45EF4D06199C1257B0F00311E8F?OpenDocument,dl-de-zero-2.0,CSV,d
,,,,,,,,,,,,,,x,,Abfallkalender 2014,http://www.moers.de/C1257221003C7526/html/7D292DF6E8B44189C1257D080042DFDE?OpenDocument,dl-de-zero-2.0,ZIP,d
,,,,,,,,,,,,x,,,,Leistungen A - Z,http://www.moers.de/C1257221003C7526/html/349AEE5EF5D5F48DC1257B190051D8F3?OpenDocument,dl-de-zero-2.0,XSP,d
,,,,,,x,,,,,,,,,,Entwicklung der Erstwunschquote zu den weiterführenden Schulen in Prozent auf Stadtgebietsebene,http://www.moers.de/C1257221003C7526/html/B91D1B3E893FD23EC1257B88004297C4?OpenDocument,dl-de-zero-2.0,CSV,d
,,,,,,x,,,,,,,,,,Erstwunschverhalten an Moerser Schulen 2013/14,http://www.moers.de/C1257221003C7526/html/4C70E937E7496731C1257B87004E26C6?OpenDocument,dl-de-zero-2.0,CSV,d
,,,,,,,,,,,,x,,,,Haushaltsplan 2014,http://www.moers.de/C1257221003C7526/html/9377A5FFD0775267C1257C910036D1C3?OpenDocument,dl-de-zero-2.0,XML,d
,,,,,,,,,,,,x,,,,Zugriffsstatistiken von moers.de für November 2013,http://www.moers.de/C1257221003C7526/html/530E45957E3F0F77C1257C19003D9324?OpenDocument,dl-de-zero-2.0,ZIP,d
x,,,,,,,,,,,,,,,,Bevölkerung in den Sozialatlasbezirken nach Religionszugehörigkeit 2011,http://www.moers.de/C1257221003C7526/html/31B3F080C11D04F6C1257B0F0030530B?OpenDocument,dl-de-zero-2.0,CSV,d
,,,,,,,,,,,,,,x,,Übersichtskarte der Innenstadt von Moers,http://www.moers.de/C1257221003C7526/html/4AB0CF7DD4B5C811C1257D5C004FC46D?OpenDocument,dl-de-zero-2.0,"TIF,PDF",d
,,,,,,,,,,,,x,,,,Facebookumfrage 2012,http://www.moers.de/C1257221003C7526/html/0E26D7D180ABFA26C1257C98002E60B8?OpenDocument,dl-de-zero-2.0,CSV,d
,,,,,,,,,,,,x,,,,Zugriffsstatistiken von moers.de für Februar 2013,http://www.moers.de/C1257221003C7526/html/CC2473D000770694C1257B24002C5204?OpenDocument,dl-de-zero-2.0,ZIP,d
,,x,,,x,,,,,,,,,,,Spielplätze,http://www.moers.de/c125722e0057acf2/files/spielplatz.json/$file/spielplatz.json?openelement,nicht bekannt,JSON,b
,,x,,,,,,,,,,,,,,Lärmkartierung,http://www.moers.de/C1257221003C7526/html/01E5B98384579590C1257D190045D884?OpenDocument,dl-de-zero-2.0,ZIP,d
,,,,,,,x,,,,,,,,,Wahlergebnis der Landtagswahl 2012 für das Moerser Stadtgebiet,http://www.moers.de/C1257221003C7526/html/6E7DD94DC8F51AA0C1257C21002C4089?OpenDocument,dl-de-zero-2.0,CSV,d
,,x,,,x,,,,,,,,,,,Strassenraster 2012,http://www.moers.de/c125722e0057acf2/files/strassenraster_2012_12.csv/$file/strassenraster_2012_12.csv?openelement,nicht bekannt,CSV,b
,,,,,,,x,,,,,x,,,,Zuwendungen Fraktionen - Geldwerte Leistungen Teil B Entwurf,http://download.moers.de/Schule%20und%20Open%20Data/Haushaltsplan%20entwurf%202014/Word_Excel/Zuwendungen%20Fraktionen%20-%20%20Geldwerte%20Leistungen%20Teil%20B%20Entwurf.xls,nicht bekannt,XLS,g
,,,,,,x,,,,,,,,,,Moers - Radwandern,http://www.moers.de/C12572210040545A/html/AEE2394426094672C125727D00498F98?openDocument=,nicht bekannt,GPX,c
,,,,,,,x,,,,,,,,,Wahlverzeichnis 2012 Landtagswahl,http://www.moers.de/c125722e0057acf2/files/lw_2012.csv/$file/lw_2012.csv?openelement,nicht bekannt,CSV,b
x,,,,,,,,,,,,,,,,Frauenanteil in den Sozialatlasbezirken nach Altersstruktur (7 Gruppen) 2012,http://www.moers.de/C1257221003C7526/html/217F36E0D5829F5FC1257B2D002AD72B?OpenDocument,dl-de-zero-2.0,CSV,d
,,,,,,,,,,,,x,,,,Zugriffsstatistiken von moers.de für März 2013,http://www.moers.de/C1257221003C7526/html/71F7BB5F88C9A45CC1257B4100277483?OpenDocument,dl-de-zero-2.0,ZIP,d
x,,,,,,,,,,,,,,,,Bevölkerung in den Sozialatlasbezirken nach Familienstand und Altersgruppen 2012,http://www.moers.de/C1257221003C7526/html/3950F5A7F5CF67CAC1257B2D002863A6?OpenDocument,dl-de-zero-2.0,CSV,d
,,,,,,,x,,,,,,,,,Straßenverzeichnis für die Kommunalwahl 2014,http://www.moers.de/C1257221003C7526/html/86352DD6D9F1F023C1257BD0002C8A56?OpenDocument,dl-de-zero-2.0,CSV,d
,,x,,,,,,,,,,,,,,Bäume und Sträucher in bebauten Ortslagen,http://www.moers.de/C1257221003C7526/html/3A13B1F522387426C1257C8200384706?OpenDocument,dl-de-zero-2.0,JSON,d
,,,,,,,,,,,,x,,,,Zugriffsstatistiken von moers.de für Oktober 2013,http://www.moers.de/C1257221003C7526/html/E9372416F3C5BED8C1257C35002FCCCE?OpenDocument,dl-de-zero-2.0,ZIP,d
,,x,,,,,,,,,,,,,,Sozialatlasbezirke,http://www.moers.de/C1257221003C7526/html/C125756100561AE6C1257B120050E59C?OpenDocument,dl-de-zero-2.0,"ZIP,PDF,JSON",d
,,,,,,,,,,,,,,x,,Verbände und Gewerkschaften,http://www.moers.de/C1257221003C7526/html/D612D8329494CBB6C1257B12004C2879?OpenDocument,dl-de-zero-2.0,XSP,d
x,,,,,,,,,,,,,,,,Beliebte Vornamen für Neugeborene 2009,http://www.moers.de/C1257221003C7526/html/7277D86C3481E8F9C1257B5C002F8D98?OpenDocument,dl-de-zero-2.0,CSV,d
,,,,,,x,,,,,,,,,,Sportstätten und Bäder,http://www.moers.de/C1257221003C7526/html/0D817E20A893CE46C1257B12003C6067?OpenDocument,dl-de-zero-2.0,XSP,d
